{
  "case_id": "01KYB9FAFRYPA5RKAFR4CGY5GB",
  "command_id": "01KYB9FAFRNZPGWP867CGV5PW8",
  "command_type": "sandbox.command",
  "expected_state_version": 1,
  "expires_at": "2026-07-25T23:59:59.000Z",
  "issued_by": "ANALYST",
  "params": {
    "action_type": "DO_SOMETHING_NOT_REGISTERED"
  },
  "policy_decision_id": "01KYB9FAFRR20M13GZCG1J13P6",
  "sandbox_id": "sandbox-dev-0001",
  "schema_version": "1.0"
}
